<?xml version="1.0" encoding="UTF-8" standalone="yes"?>
<!--W3C Schema generated by XMLSpy v2005 sp1 U (http://www.xmlspy.com)-->
<xs:schema xmlns:xs="http://www.w3.org/2001/XMLSchema" elementFormDefault="qualified">
	<xs:element name="Posten">
		<xs:complexType>
			<xs:attribute name="P_Nr" type="xs:string" use="required"/>
			<xs:attribute name="R_Nr" type="xs:string" use="required"/>
			<xs:attribute name="P_Summe" type="xs:string" use="required"/>
			<xs:attribute name="T_Nr" type="xs:string" use="required"/>
		</xs:complexType>
	</xs:element>
	<xs:element name="Rechnung">
		<xs:complexType>
			<xs:sequence>
				<xs:element ref="Posten" maxOccurs="unbounded"/>
			</xs:sequence>
			<xs:attribute name="R_Nr" type="xs:string" use="required"/>
			<xs:attribute name="R_Datum" type="xs:string" use="required"/>
			<xs:attribute name="R_Summe" type="xs:string" use="required"/>
		</xs:complexType>
	</xs:element>
	<xs:element name="Umsatzliste">
		<xs:complexType>
			<xs:sequence>
				<xs:element ref="Rechnung" maxOccurs="unbounded"/>
			</xs:sequence>
		</xs:complexType>
	</xs:element>
</xs:schema>
